### ISSUE TITLE
以容器运行时，作为旁路由网关无法转发路由

### ISSUE THREAD

**Issue by FUjr** [coolsnowwolf/lede#6181]
反馈bug/问题模板，提建议请删除

## 1.关于你要提交的问题

Q：是否搜索了issue (使用 "x" 选择)
* [ x] 没有类似的issue

### (1) 具体问题

A：
在--privileged参数下运行的是用树莓派3b docker版配置文件编译的版本，通过macvlan对外做旁路由

现在遇到的问题是：
容器路由表正常的情况下，局域网设备可以访问网页，在容器的shell中ping外网也能通，但是当手动设置手机网关为容器ip时，手机却无法正常路由，局域网内tcpdump可抓到手机和容器发出的arp包
 
但是神奇的是，在容器中开启tcpdump时，居然一切正常了。
结束tcpdump进程后又恢复原来的样子

我是技术小白，我猜测是什么模块没开起来，而这个模块恰是tcpdump需要调用的，因此能够成功路由

### (2) 路由器型号和固件版本

A：
nanopi neo2（H5）刷的 armbian

宿主机系统：Debian GNU/Linux 10 (buster) with Linux 5.9.14-sunxi64

OpenWrt R20.12.12 / LuCI Master (git-20.343.54716-6fc079f)

用的原生网卡，网卡是RTL8211E-VB-CG

### (3) 详细日志

A：
tcpdump抓包能抓到双方arp广播

其中192.168.3.9是客户端，192.168.3.1是硬路由网关，192.168.3.5是docker旁路由网关，183.232.231.172是ping的目标（百度的ip）

00:41:10.874204 IP 192.168.3.9 > 183.232.231.172: ICMP echo request, id 81, seq 6, length 64
00:41:10.887715 ARP, Request who-has 192.168.3.109 tell 192.168.3.5, length 28
00:41:10.888133 ARP, Reply 192.168.3.109 is-at b8:27:eb:4f:ce:e3 (oui Unknown), length 46
00:41:11.898210 IP 192.168.3.9 > 183.232.231.172: ICMP echo request, id 81, seq 7, length 64
00:41:12.922567 IP 192.168.3.9 > 183.232.231.172: ICMP echo request, id 81, seq 8, length 64
00:41:13.946209 IP 192.168.3.9 > 183.232.231.172: ICMP echo request, id 81, seq 9, length 64
00:41:14.970134 IP 192.168.3.9 > 183.232.231.172: ICMP echo request, id 81, seq 10, length 64
00:41:15.479203 IP 192.168.3.109.36783 > 192.168.3.5.45515: UDP, length 3600:41:15.994169 IP 192.168.3.9 > 183.232.231.172: ICMP echo request, id 81, seq 11, length 64
00:41:17.018157 IP 192.168.3.9 > 183.232.231.172: ICMP echo request, id 81, seq 12, length 64
00:41:18.042119 IP 192.168.3.9 > 183.232.231.172: ICMP echo request, id 81, seq 13, length 64
00:41:19.066187 IP 192.168.3.9 > 183.232.231.172: ICMP echo request, id 81, seq 14, length 64
00:41:20.090097 IP 192.168.3.9 > 183.232.231.172: ICMP echo request, id 81, seq 15, length 64
^[[C00:41:21.114114 IP 192.168.3.9 > 183.232.231.172: ICMP echo request, id 81, seq 16, length 64
00:41:22.138095 IP 192.168.3.9 > 183.232.231.172: ICMP echo request, id 81, seq 17, length 64
00:41:23.162125 IP 192.168.3.9 > 183.232.231.172: ICMP echo request, id 81, seq 18, length 64
00:41:24.005142 IP 192.168.3.109.36783 > 192.168.3.5.45515: UDP, length 3600:41:24.005348 IP 192.168.3.109.36783 > 224.0.0.68.1968: UDP, length 36
00:41:24.007509 IP 192.168.3.5.45515 > 192.168.3.109.36783: UDP, length 3600:41:24.186069 IP 192.168.3.9 > 183.232.231.172: ICMP echo request, id 81, seq 19, length 64
00:41:25.210030 IP 192.168.3.9 > 183.232.231.172: ICMP echo request, id 81, seq 20, length 64
00:41:26.234050 IP 192.168.3.9 > 183.232.231.172: ICMP echo request, id 81, seq 21, length 64
00:41:27.258095 IP 192.168.3.9 > 183.232.231.172: ICMP echo request, id 81, seq 22, length 64
00:41:36.453035 ARP, Request who-has _gateway (Broadcast) tell 192.168.3.109, length 46
00:41:36.457294 ARP, Request who-has 192.168.3.5 (Broadcast) tell 192.168.3.109, length 46
00:41:36.457410 ARP, Reply 192.168.3.5 is-at 02:42:c0:a8:03:05 (oui Unknown), length 28
00:41:36.459640 ARP, Request who-has 192.168.3.4 (Broadcast) tell 192.168.3.109, length 46
00:41:36.459694 ARP, Reply 192.168.3.4 is-at 02:42:c0:a8:03:04 (oui Unknown), length 28
00:41:36.471942 IP 192.168.3.109.36783 > 224.0.0.68.1968: UDP, length 36
00:41:36.472725 IP 192.168.3.5.45515 > 192.168.3.109.36783: UDP, length 3600:41:40.022047 ARP, Request who-has 192.168.3.109 (Broadcast) tell 192.168.3.5, length 28
00:41:40.022541 ARP, Reply 192.168.3.109 is-at b8:27:eb:4f:ce:e3 (oui Unknown), length 46
00:41:40.413855 IP 192.168.3.109.36783 > 192.168.3.5.45515: UDP, length 8500:41:40.652548 ARP, Request who-has 192.168.3.9 (Broadcast) tell 192.168.3.5, length 28
00:41:40.653066 ARP, Reply 192.168.3.9 is-at 02:42:c0:a8:03:09 (oui Unknown), length 46

**Comment by FUjr** [comment]
写了个脚本放到 /etc/rc.local开tcpdump，虽然治标不治本，但又不是不能用！！``

`#!/bin/bash
while true 
do
d=`date '+%F %T'`;
num=`ps  | grep 'tcpdump' | egrep -v 'grep|echo|rpm|moni|guard' | wc -l`;
if [ $num -lt 1 ];then

 echo "[$d] tcpdump is dead...restarting" >> /root/tcpdump/tcpdump.log ;
 echo "[$d] tcpdump is dead...restarting";
 nohup tcpdump host 192.168.4.1 ;
 sleep 5
fi
sleep 10
done
`
写好脚本，放在任意目录，再把脚本写入/etc/rc.local就好啦～
如果你网段是192.168.4.1，那我建议你还是小改一下，以免nohup.out体积爆炸

另外就是希望大佬给点解决思路，感谢！

**Comment by LGA1150** [comment]
> 但是神奇的是，在容器中开启tcpdump时，居然一切正常了。
结束tcpdump进程后又恢复原来的样子

tcpdump 不加 `-p` 参数时会开启网卡混杂模式
你可以手动打开试试
`ip link set 网卡名称 promisc on`

**Comment by FUjr** [comment]
> > 但是神奇的是，在容器中开启tcpdump时，居然一切正常了。
> 结束tcpdump进程后又恢复原来的样子
> 
> tcpdump 不加 `-p` 参数时会开启网卡混杂模式
> 你可以手动打开试试
> `ip link set 网卡名称 promisc on`

感谢帮助，不过我宿主机确实开了混杂模式,而且如果不开混杂模式的话，我应该是连ssh、web管理都上不去的，所以暂时排除这个引起的了。

![Screenshot_20210131-231829.jpg](https://user-images.githubusercontent.com/53910283/106388902-800a8600-641b-11eb-81a4-25fbc5d08e9b.jpg)

privilege特权也是给了的。

**Comment by 1049066154** [comment]
你是不是在防火墙中加了什么代码？

**Comment by FUjr** [comment]
> 你是不是在防火墙中加了什么代码？

好像都是默认的呀

**Comment by fyxw** [comment]
> > > 但是神奇的是，在容器中开启tcpdump时，居然一切正常了。
> > > 结束tcpdump进程后又恢复原来的样子
> > 
> > 
> > tcpdump 不加 `-p` 参数时会开启网卡混杂模式
> > 你可以手动打开试试
> > `ip link set 网卡名称 promisc on`
> 
> 感谢帮助，不过我宿主机确实开了混杂模式,而且如果不开混杂模式的话，我应该是连ssh、web管理都上不去的，所以暂时排除这个引起的了。
> 
> ![Screenshot_20210131-231829.jpg](https://user-images.githubusercontent.com/53910283/106388902-800a8600-641b-11eb-81a4-25fbc5d08e9b.jpg)
> 
> privilege特权也是给了的。

从你发的截图来看，是没开混杂的，`Multicast`是多播，不是混杂，从我使用中发现，不开混杂时有几率能连上容器内的web和ssh，但是路由不稳定的。

 `ip link set 网卡名称 promisc on`要放在宿主机开机脚本里，不然重启就失效了。

建议不要给`privilege`特权，反而会导致内核不稳定，而且重启容器会导致宿主机也重启。用`--cap-add NET_ADMIN --cap-add NET_RAW`替代就可以了，需要更多权限就换成`--cap-add ALL`，需要加载的内核模块，直接在宿主机里加载，然后重启容器
