### ISSUE TITLE
pppoe重新拨号后, ipsec-server 可连接，无法上网

### ISSUE THREAD

**Issue by Ansen** [coolsnowwolf/lede#14082]
### 详细叙述

> Firmware Version | LEDE R25.8.8 / LuCI openwrt-23.05 branch git-26.103.25611-03b3a44

表现为，客户端能正常连接VPN，但是无法上网， 客户端Ping网关，openwrt能收到包，没有回包

> 临时解决方案：添加勾子重启 ipsec

```bash

root@LEDE:~# cat /etc/hotplug.d/iface/99-ipsec-restart 
#!/bin/sh
# 仅在接口连通时触发
[ "$ACTION" = "ifup" ] || exit 0
# 仅针对 wan 接口触发 (OpenWrt中逻辑接口通常叫 wan)
[ "$INTERFACE" = "wan" ] || exit 0

# 在系统日志中记录一条信息，方便你以后排查
logger -t ipsec-hotplug "PPPoE (wan) reconnected. Restarting IPsec to fix routing..."
# 重启 IPsec 服务
/etc/init.d/ipsec restart
```
记得添加执行权限： chmod +x /etc/hotplug.d/iface/99-ipsec-restart 

> 抓包

```
root@LEDE:~# tcpdump -i ipsec0 icmp -nn
tcpdump: verbose output suppressed, use -v[v]... for full protocol decode
listening on ipsec0, link-type RAW (Raw IP), snapshot length 262144 bytes
23:35:56.790514 IP 10.0.0.50 > 10.0.0.1: ICMP echo request, id 16, seq 23, length 64
23:35:57.790241 IP 10.0.0.50 > 10.0.0.1: ICMP echo request, id 16, seq 24, length 64
23:35:58.800406 IP 10.0.0.50 > 10.0.0.1: ICMP echo request, id 16, seq 25, length 64
23:35:59.815462 IP 10.0.0.50 > 10.0.0.1: ICMP echo request, id 16, seq 26, length 64
23:36:00.815992 IP 10.0.0.50 > 10.0.0.1: ICMP echo request, id 16, seq 27, length 64
23:36:01.815518 IP 10.0.0.50 > 10.0.0.1: ICMP echo request, id 16, seq 28, length 64
23:36:02.815344 IP 10.0.0.50 > 10.0.0.1: ICMP echo request, id 16, seq 29, length 64
23:36:03.830098 IP 10.0.0.50 > 10.0.0.1: ICMP echo request, id 16, seq 30, length 64
23:36:04.830234 IP 10.0.0.50 > 10.0.0.1: ICMP echo request, id 16, seq 31, length 64
^C
9 packets captured
9 packets received by filter
0 packets dropped by kernel
```

### 重复 issue

- [x] 没有类似的 issue

### 具体型号

x86

### 详细日志

```bash
root@LEDE:~# logread -f
Mon Jul  6 23:26:47 2026 daemon.info : 14[KNL] interface ztukuvylmh deactivated
Mon Jul  6 23:26:47 2026 daemon.info : 13[KNL] fe80::b473:43ff:fe57:8e63 disappeared from ztukuvylmh
Mon Jul  6 23:26:47 2026 daemon.info : 10[KNL] 192.168.195.25 disappeared from ztukuvylmh
Mon Jul  6 23:26:47 2026 daemon.info : 14[KNL] interface ztukuvylmh deleted
Mon Jul  6 23:26:47 2026 daemon.err zerotier-one[28750]: Control Plane Stopped
Mon Jul  6 23:26:47 2026 daemon.err zerotier-one[28750]: V6 Control Plane Stopped
Mon Jul  6 23:26:49 2026 daemon.err zerotier-one[2165]: Starting Control Plane...
Mon Jul  6 23:26:49 2026 daemon.err zerotier-one[2165]: Starting V6 Control Plane...
Mon Jul  6 23:26:49 2026 daemon.info : 13[KNL] interface ztukuvylmh activated
Mon Jul  6 23:26:49 2026 user.notice : Added device handler type: 8021ad
Mon Jul  6 23:26:49 2026 user.notice : Added device handler type: 8021q
Mon Jul  6 23:26:49 2026 user.notice : Added device handler type: macvlan
Mon Jul  6 23:26:49 2026 user.notice : Added device handler type: veth
Mon Jul  6 23:26:49 2026 user.notice : Added device handler type: bridge
Mon Jul  6 23:26:49 2026 user.notice : Added device handler type: Network device
Mon Jul  6 23:26:49 2026 user.notice : Added device handler type: tunnel
Mon Jul  6 23:26:49 2026 daemon.info : 10[KNL] interface br-lan deactivated
Mon Jul  6 23:26:49 2026 kern.info kernel: [739970.344654] br-lan: port 1(eth0) entered disabled state
Mon Jul  6 23:26:49 2026 kern.info kernel: [739970.348656] virtio_net virtio2 eth0: left allmulticast mode
Mon Jul  6 23:26:49 2026 kern.info kernel: [739970.350092] virtio_net virtio2 eth0: left promiscuous mode
Mon Jul  6 23:26:49 2026 daemon.info : 12[KNL] 2408:8266:403:4b5f::1 disappeared from br-lan
Mon Jul  6 23:26:49 2026 daemon.info : 14[KNL] fd5e:ad64:4d80::1 disappeared from br-lan
Mon Jul  6 23:26:49 2026 daemon.info : 16[KNL] fe80::6450:daff:fe86:d40c disappeared from br-lan
Mon Jul  6 23:26:49 2026 daemon.info : 10[KNL] interface eth0 deleted
Mon Jul  6 23:26:49 2026 daemon.info : 15[KNL] interface eth0 activated
Mon Jul  6 23:26:49 2026 daemon.info : 09[KNL] 10.0.0.1 disappeared from br-lan
Mon Jul  6 23:26:49 2026 kern.info kernel: [739970.351638] br-lan: port 1(eth0) entered disabled state
Mon Jul  6 23:26:49 2026 daemon.info : 14[KNL] interface br-lan deleted
Mon Jul  6 23:26:49 2026 daemon.info : 10[KNL] interface lo deactivated
Mon Jul  6 23:26:49 2026 daemon.info : 12[KNL] ::1 disappeared from lo
Mon Jul  6 23:26:49 2026 daemon.info : 13[KNL] 127.0.0.1 disappeared from lo
Mon Jul  6 23:26:49 2026 daemon.notice pppd[26992]: Modem hangup
Mon Jul  6 23:26:49 2026 daemon.err odhcp6c[22132]: Failed to send RS (Permission denied)
Mon Jul  6 23:26:49 2026 daemon.info : 10[KNL] interface eth1 deactivated
Mon Jul  6 23:26:49 2026 daemon.info : 14[KNL] fe80::604e:f6ff:fe9c:71c9 disappeared from eth1
Mon Jul  6 23:26:49 2026 daemon.info pppd[26992]: Connect time 177.9 minutes.
Mon Jul  6 23:26:49 2026 daemon.info pppd[26992]: Sent 71691175 bytes, received 3199593 bytes.
Mon Jul  6 23:26:49 2026 daemon.err miniupnpd[27649]: ioctl(s, SIOCGIFADDR, ...): Address not available
Mon Jul  6 23:26:49 2026 daemon.err miniupnpd[27649]: Failed to get IP for interface pppoe-wan
Mon Jul  6 23:26:49 2026 daemon.warn miniupnpd[27649]: SendNATPMPPublicAddressChangeNotification: cannot get public IP address, stopping
Mon Jul  6 23:26:49 2026 daemon.info : 11[KNL] 119.6.178.93 disappeared from pppoe-wan
Mon Jul  6 23:26:49 2026 daemon.info : 15[KNL] interface eth2 deactivated
Mon Jul  6 23:26:49 2026 daemon.info : 11[KNL] fe80::a85e:1eff:fed4:a217 disappeared from eth2
Mon Jul  6 23:26:49 2026 daemon.info : 13[KNL] fe80::624e:f6da:6d9c:71c9 disappeared from pppoe-wan
Mon Jul  6 23:26:49 2026 daemon.notice pppd[26992]: Connection terminated.
Mon Jul  6 23:26:49 2026 daemon.info : 09[KNL] interface pppoe-wan deactivated
Mon Jul  6 23:26:49 2026 daemon.info pppd[26992]: Connect time 177.9 minutes.
Mon Jul  6 23:26:49 2026 daemon.info pppd[26992]: Sent 71691175 bytes, received 3199593 bytes.
Mon Jul  6 23:26:49 2026 daemon.info : 14[KNL] 192.168.1.222 disappeared from eth2
Mon Jul  6 23:26:49 2026 daemon.info : 13[KNL] interface eth3 deactivated
Mon Jul  6 23:26:49 2026 daemon.info : 09[KNL] fe80::d40a:5fff:fe08:19ed disappeared from eth3
Mon Jul  6 23:26:49 2026 daemon.info : 13[KNL] interface pppoe-wan deleted
Mon Jul  6 23:26:49 2026 daemon.info : 11[KNL] 192.168.2.123 disappeared from eth3
Mon Jul  6 23:26:49 2026 daemon.info : 10[KNL] interface ipsec0 deactivated
Mon Jul  6 23:26:49 2026 daemon.info : 13[KNL] fe80::9806:3cf9:4fcc:b1f disappeared from ipsec0
Mon Jul  6 23:26:49 2026 daemon.info : 11[KNL] 192.168.0.1 disappeared from ipsec0
Mon Jul  6 23:26:49 2026 daemon.info : 15[KNL] interface eth0 deactivated
Mon Jul  6 23:26:49 2026 daemon.info : 09[KNL] interface eth0 activated
Mon Jul  6 23:26:49 2026 kern.info kernel: [739970.501229] 8021q: adding VLAN 0 to HW filter on device eth0
Mon Jul  6 23:26:49 2026 kern.info kernel: [739970.503083] br-lan: port 1(eth0) entered blocking state
Mon Jul  6 23:26:49 2026 kern.info kernel: [739970.504505] br-lan: port 1(eth0) entered disabled state
Mon Jul  6 23:26:49 2026 kern.info kernel: [739970.505905] virtio_net virtio2 eth0: entered allmulticast mode
Mon Jul  6 23:26:49 2026 kern.info kernel: [739970.507555] virtio_net virtio2 eth0: entered promiscuous mode
Mon Jul  6 23:26:49 2026 daemon.info : 12[KNL] interface br-lan activated
Mon Jul  6 23:26:49 2026 daemon.notice netifd: Interface 'lan' is enabled
Mon Jul  6 23:26:49 2026 daemon.notice netifd: Interface 'lan' is setting up now
Mon Jul  6 23:26:49 2026 daemon.info : 09[KNL] 10.0.0.1 appeared on br-lan
Mon Jul  6 23:26:49 2026 daemon.notice netifd: Interface 'lan' is now up
Mon Jul  6 23:26:49 2026 daemon.info : 14[KNL] fd5e:ad64:4d80::1 appeared on br-lan
Mon Jul  6 23:26:49 2026 daemon.notice netifd: Interface 'VPN' is enabled
Mon Jul  6 23:26:49 2026 daemon.notice netifd: Interface 'VPN' is setting up now
Mon Jul  6 23:26:49 2026 daemon.info : 10[KNL] interface ipsec0 activated
Mon Jul  6 23:26:49 2026 daemon.info : 09[KNL] fe80::9806:3cf9:4fcc:b1f appeared on ipsec0
Mon Jul  6 23:26:49 2026 daemon.notice netifd: Interface 'VPN' is now up
Mon Jul  6 23:26:49 2026 daemon.notice netifd: Interface 'loopback' is enabled
Mon Jul  6 23:26:49 2026 daemon.notice netifd: Interface 'loopback' is setting up now
Mon Jul  6 23:26:49 2026 daemon.notice netifd: Interface 'loopback' is now up
Mon Jul  6 23:26:49 2026 daemon.info : 13[KNL] 192.168.0.1 appeared on ipsec0
Mon Jul  6 23:26:49 2026 daemon.err odhcp6c[2683]: Failed to send SOLICIT message to ff02::1:2 (Permission denied)
Mon Jul  6 23:26:49 2026 daemon.notice netifd: Interface 'modem' is enabled
Mon Jul  6 23:26:49 2026 daemon.notice netifd: Interface 'modem' is setting up now
Mon Jul  6 23:26:49 2026 daemon.info : 12[KNL] interface lo activated
Mon Jul  6 23:26:49 2026 kern.info kernel: [739970.527080] 8021q: adding VLAN 0 to HW filter on device eth3
Mon Jul  6 23:26:49 2026 daemon.notice netifd: Interface 'modem' is now up
Mon Jul  6 23:26:49 2026 daemon.info : 09[KNL] 127.0.0.1 appeared on lo
Mon Jul  6 23:26:49 2026 daemon.info : 11[KNL] ::1 appeared on lo
Mon Jul  6 23:26:49 2026 daemon.info : 12[KNL] interface eth3 activated
Mon Jul  6 23:26:49 2026 daemon.info : 09[KNL] 192.168.2.123 appeared on eth3
Mon Jul  6 23:26:49 2026 daemon.notice netifd: Interface 'telecom' is enabled
Mon Jul  6 23:26:49 2026 daemon.notice netifd: Interface 'telecom' is setting up now
Mon Jul  6 23:26:49 2026 daemon.info : 11[KNL] interface eth2 activated
Mon Jul  6 23:26:49 2026 daemon.info : 10[KNL] 192.168.1.222 appeared on eth2
Mon Jul  6 23:26:49 2026 kern.info kernel: [739970.534716] 8021q: adding VLAN 0 to HW filter on device eth2
Mon Jul  6 23:26:49 2026 daemon.notice netifd: Interface 'telecom' is now up
Mon Jul  6 23:26:49 2026 daemon.err odhcp6c[2683]: Failed to send RS (Permission denied)
Mon Jul  6 23:26:49 2026 daemon.info : 16[KNL] interface eth1 activated
Mon Jul  6 23:26:49 2026 daemon.notice netifd: Interface 'wan' is enabled
Mon Jul  6 23:26:49 2026 daemon.notice netifd: Interface 'wan6' is enabled
Mon Jul  6 23:26:49 2026 kern.info kernel: [739970.541319] 8021q: adding VLAN 0 to HW filter on device eth1
Mon Jul  6 23:26:49 2026 kern.info kernel: [739970.546644] br-lan: port 1(eth0) entered blocking state
Mon Jul  6 23:26:49 2026 kern.info kernel: [739970.548102] br-lan: port 1(eth0) entered forwarding state
Mon Jul  6 23:26:49 2026 daemon.notice netifd: Network device 'eth0' link is up
Mon Jul  6 23:26:49 2026 daemon.notice netifd: bridge 'br-lan' link is up
Mon Jul  6 23:26:49 2026 daemon.notice netifd: Interface 'lan' has link connectivity
Mon Jul  6 23:26:49 2026 daemon.notice netifd: Network device 'lo' link is up
Mon Jul  6 23:26:49 2026 daemon.notice netifd: Interface 'loopback' has link connectivity
Mon Jul  6 23:26:49 2026 daemon.notice netifd: Network device 'eth1' link is up
Mon Jul  6 23:26:49 2026 daemon.notice netifd: Interface 'wan' has link connectivity
Mon Jul  6 23:26:49 2026 daemon.notice netifd: Interface 'wan' is setting up now
Mon Jul  6 23:26:49 2026 daemon.notice netifd: Interface 'wan6' has link connectivity
Mon Jul  6 23:26:49 2026 daemon.notice netifd: Interface 'wan6' is setting up now
Mon Jul  6 23:26:49 2026 daemon.notice netifd: Network device 'eth2' link is up
Mon Jul  6 23:26:49 2026 daemon.notice netifd: Interface 'telecom' has link connectivity
Mon Jul  6 23:26:49 2026 daemon.notice netifd: Network device 'eth3' link is up
Mon Jul  6 23:26:49 2026 daemon.notice netifd: Interface 'modem' has link connectivity
Mon Jul  6 23:26:49 2026 daemon.notice netifd: Network device 'ipsec0' link is up
Mon Jul  6 23:26:49 2026 daemon.notice netifd: Interface 'VPN' has link connectivity
Mon Jul  6 23:26:49 2026 daemon.info pppd[26992]: Exit.
Mon Jul  6 23:26:49 2026 daemon.err odhcp6c[2312]: Failed to send RS (Address not available)
Mon Jul  6 23:26:49 2026 user.notice firewall: Reloading firewall due to ifup of lan (br-lan)
Mon Jul  6 23:26:49 2026 daemon.notice netifd: wan (2294): uci: Entry not found
Mon Jul  6 23:26:49 2026 daemon.notice netifd: wan (2294): sh: out of range
Mon Jul  6 23:26:49 2026 daemon.info pppd[2331]: Plugin pppoe.so loaded.
Mon Jul  6 23:26:49 2026 daemon.info pppd[2331]: PPPoE plugin from pppd 2.4.9
Mon Jul  6 23:26:49 2026 daemon.notice pppd[2331]: pppd 2.4.9 started by root, uid 0
Mon Jul  6 23:26:50 2026 user.notice nlbwmon: Reloading nlbwmon due to ifup of lan (br-lan)
Mon Jul  6 23:26:50 2026 daemon.info : 11[KNL] fe80::b473:43ff:fe57:8e63 appeared on ztukuvylmh
Mon Jul  6 23:26:50 2026 daemon.notice miniupnpd[27649]: shutting down MiniUPnPd
Mon Jul  6 23:26:50 2026 daemon.err miniupnpd[27649]: sendto(udp_shutdown=6): No such device
Mon Jul  6 23:26:50 2026 daemon.err miniupnpd[27649]: sendto(udp_shutdown=6): No such device
Mon Jul  6 23:26:50 2026 daemon.err miniupnpd[27649]: sendto(udp_shutdown=6): No such device
Mon Jul  6 23:26:50 2026 daemon.err miniupnpd[27649]: sendto(udp_shutdown=6): No such device
Mon Jul  6 23:26:50 2026 daemon.err miniupnpd[27649]: sendto(udp_shutdown=6): No such device
Mon Jul  6 23:26:50 2026 daemon.err miniupnpd[27649]: sendto(udp_shutdown=6): No such device
Mon Jul  6 23:26:50 2026 daemon.err miniupnpd[27649]: sendto(udp_shutdown=6): No such device
Mon Jul  6 23:26:50 2026 daemon.err miniupnpd[27649]: sendto(udp_shutdown=6): No such device
Mon Jul  6 23:26:50 2026 daemon.err miniupnpd[27649]: sendto(udp_shutdown=6): No such device
Mon Jul  6 23:26:50 2026 daemon.err miniupnpd[27649]: sendto(udp_shutdown=6): No such device
Mon Jul  6 23:26:50 2026 daemon.err miniupnpd[27649]: sendto(udp_shutdown=6): No such device
Mon Jul  6 23:26:50 2026 daemon.err miniupnpd[27649]: Failed to broadcast good-bye notifications
Mon Jul  6 23:26:50 2026 daemon.err odhcp6c[9191]: Failed to send SOLICIT message to ff02::1:2 (Address not available)
Mon Jul  6 23:26:50 2026 daemon.err odhcp6c[9191]: Failed to send RS (Address not available)
Mon Jul  6 23:26:50 2026 user.notice upnp daemon: external interface not found, not starting
Mon Jul  6 23:26:50 2026 daemon.err odhcp6c[12453]: Failed to send SOLICIT message to ff02::1:2 (Address not available)
Mon Jul  6 23:26:50 2026 daemon.err odhcp6c[12453]: Failed to send RS (Address not available)
Mon Jul  6 23:26:50 2026 daemon.notice miniupnpd[2610]: HTTP listening on port 5000
Mon Jul  6 23:26:50 2026 daemon.notice miniupnpd[2610]: Listening for NAT-PMP/PCP traffic on port 5351
Mon Jul  6 23:26:50 2026 daemon.err odhcp6c[12453]: Failed to send SOLICIT message to ff02::1:2 (Address not available)
Mon Jul  6 23:26:50 2026 daemon.err odhcp6c[2683]: Failed to send SOLICIT message to ff02::1:2 (Address not available)
Mon Jul  6 23:26:50 2026 daemon.err odhcp6c[2312]: Failed to send SOLICIT message to ff02::1:2 (Address not available)
Mon Jul  6 23:26:50 2026 user.notice firewall: Reloading firewall due to ifup of VPN (ipsec0)
Mon Jul  6 23:26:50 2026 daemon.err odhcp6c[22132]: Failed to send SOLICIT message to ff02::1:2 (Address not available)
Mon Jul  6 23:26:50 2026 daemon.err odhcp6c[22132]: Failed to send RS (Address not available)
Mon Jul  6 23:26:50 2026 daemon.err odhcp6c[9191]: Failed to send SOLICIT message to ff02::1:2 (Address not available)
Mon Jul  6 23:26:50 2026 user.notice nlbwmon: Reloading nlbwmon due to ifup of VPN (ipsec0)
Mon Jul  6 23:26:51 2026 daemon.err procd: Got unexpected signal 1
Mon Jul  6 23:26:51 2026 daemon.notice ksmbd: Stopping Ksmbd userspace service.
Mon Jul  6 23:26:51 2026 daemon.err odhcp6c[22132]: Failed to send SOLICIT message to ff02::1:2 (Address not available)
Mon Jul  6 23:26:51 2026 daemon.info : 14[KNL] fe80::a85e:1eff:fed4:a217 appeared on eth2
Mon Jul  6 23:26:51 2026 user.notice nlbwmon: Reloading nlbwmon due to ifup of loopback (lo)
Mon Jul  6 23:26:51 2026 daemon.info : 10[KNL] flags changed for fd5e:ad64:4d80::1 on br-lan
Mon Jul  6 23:26:51 2026 daemon.info : 15[KNL] fe80::6450:daff:fe86:d40c appeared on br-lan
Mon Jul  6 23:26:51 2026 daemon.info : 13[KNL] fe80::d40a:5fff:fe08:19ed appeared on eth3
Mon Jul  6 23:26:51 2026 daemon.err odhcp6c[12453]: Failed to send SOLICIT message to ff02::1:2 (Address not available)
Mon Jul  6 23:26:51 2026 daemon.notice ksmbd: Starting Ksmbd userspace service.
Mon Jul  6 23:26:51 2026 daemon.err odhcp6c[2683]: Failed to send SOLICIT message to ff02::1:2 (Address not available)
Mon Jul  6 23:26:51 2026 daemon.err odhcp6c[2312]: Failed to send SOLICIT message to ff02::1:2 (Address not available)
Mon Jul  6 23:26:51 2026 daemon.info : 14[KNL] fe80::604e:f6ff:fe9c:71c9 appeared on eth1
Mon Jul  6 23:26:51 2026 user.notice firewall: Reloading firewall due to ifup of modem (eth3)
Mon Jul  6 23:26:52 2026 user.notice nlbwmon: Reloading nlbwmon due to ifup of modem (eth3)
Mon Jul  6 23:26:52 2026 user.notice nlbwmon: Reloading nlbwmon due to ifup of telecom (eth2)
Mon Jul  6 23:27:05 2026 daemon.warn pppd[2331]: Timeout waiting for PADS packets
Mon Jul  6 23:27:05 2026 daemon.err pppd[2331]: Unable to complete PPPoE Discovery
Mon Jul  6 23:27:05 2026 daemon.info pppd[2331]: Exit.
Mon Jul  6 23:27:05 2026 daemon.notice netifd: Interface 'wan' is now down
Mon Jul  6 23:27:05 2026 daemon.notice netifd: Interface 'wan' is setting up now
Mon Jul  6 23:27:05 2026 daemon.notice netifd: wan (4244): uci: Entry not found
Mon Jul  6 23:27:05 2026 daemon.notice netifd: wan (4244): sh: out of range
Mon Jul  6 23:27:05 2026 daemon.info pppd[4282]: Plugin pppoe.so loaded.
Mon Jul  6 23:27:05 2026 daemon.info pppd[4282]: PPPoE plugin from pppd 2.4.9
Mon Jul  6 23:27:05 2026 daemon.notice pppd[4282]: pppd 2.4.9 started by root, uid 0
Mon Jul  6 23:27:06 2026 daemon.info : 15[KNL] interface ztukuvylmh deactivated
Mon Jul  6 23:27:06 2026 daemon.info : 10[KNL] fe80::b473:43ff:fe57:8e63 disappeared from ztukuvylmh
Mon Jul  6 23:27:06 2026 daemon.info : 16[KNL] interface ztukuvylmh deleted
Mon Jul  6 23:27:06 2026 daemon.err zerotier-one[2165]: Control Plane Stopped
Mon Jul  6 23:27:06 2026 daemon.err zerotier-one[2165]: V6 Control Plane Stopped
Mon Jul  6 23:27:07 2026 daemon.err zerotier-one[4511]: Starting Control Plane...
Mon Jul  6 23:27:07 2026 daemon.err zerotier-one[4511]: Starting V6 Control Plane...
Mon Jul  6 23:27:07 2026 daemon.info : 09[KNL] interface ztukuvylmh activated
Mon Jul  6 23:27:09 2026 daemon.info : 09[KNL] fe80::b473:43ff:fe57:8e63 appeared on ztukuvylmh
Mon Jul  6 23:27:14 2026 daemon.err pppd[4282]: select (waitForPADS): Interrupted system call
Mon Jul  6 23:27:14 2026 daemon.warn pppd[4282]: Timeout waiting for PADS packets
Mon Jul  6 23:27:14 2026 daemon.err pppd[4282]: Unable to complete PPPoE Discovery
Mon Jul  6 23:27:14 2026 daemon.info pppd[4282]: Exit.
Mon Jul  6 23:27:14 2026 daemon.notice netifd: Interface 'wan' is now down
Mon Jul  6 23:27:14 2026 daemon.notice netifd: Interface 'wan' is setting up now
Mon Jul  6 23:27:14 2026 daemon.notice netifd: wan (4604): uci: Entry not found
Mon Jul  6 23:27:14 2026 daemon.notice netifd: wan (4604): sh: out of range
Mon Jul  6 23:27:14 2026 daemon.info pppd[4642]: Plugin pppoe.so loaded.
Mon Jul  6 23:27:14 2026 daemon.info pppd[4642]: PPPoE plugin from pppd 2.4.9
Mon Jul  6 23:27:14 2026 daemon.notice pppd[4642]: pppd 2.4.9 started by root, uid 0
Mon Jul  6 23:27:15 2026 daemon.info : 16[KNL] interface ztukuvylmh deactivated
Mon Jul  6 23:27:15 2026 daemon.info : 10[KNL] fe80::b473:43ff:fe57:8e63 disappeared from ztukuvylmh
Mon Jul  6 23:27:15 2026 daemon.info : 12[KNL] interface ztukuvylmh deleted
Mon Jul  6 23:27:15 2026 daemon.err zerotier-one[4511]: Control Plane Stopped
Mon Jul  6 23:27:15 2026 daemon.err zerotier-one[4511]: V6 Control Plane Stopped
Mon Jul  6 23:27:17 2026 daemon.err zerotier-one[4871]: Starting Control Plane...
Mon Jul  6 23:27:17 2026 daemon.err zerotier-one[4871]: Starting V6 Control Plane...
Mon Jul  6 23:27:17 2026 daemon.info : 09[KNL] interface ztukuvylmh activated
Mon Jul  6 23:27:18 2026 daemon.info : 09[KNL] fe80::b473:43ff:fe57:8e63 appeared on ztukuvylmh
Mon Jul  6 23:27:29 2026 daemon.warn pppd[4642]: Timeout waiting for PADS packets
Mon Jul  6 23:27:29 2026 daemon.err pppd[4642]: Unable to complete PPPoE Discovery
Mon Jul  6 23:27:29 2026 daemon.info pppd[4642]: Exit.
Mon Jul  6 23:27:29 2026 daemon.notice netifd: Interface 'wan' is now down
Mon Jul  6 23:27:29 2026 daemon.notice netifd: Interface 'wan' is setting up now
Mon Jul  6 23:27:29 2026 daemon.notice netifd: wan (4960): uci: Entry not found
Mon Jul  6 23:27:29 2026 daemon.notice netifd: wan (4960): sh: out of range
Mon Jul  6 23:27:29 2026 daemon.info pppd[4995]: Plugin pppoe.so loaded.
Mon Jul  6 23:27:29 2026 daemon.info pppd[4995]: PPPoE plugin from pppd 2.4.9
Mon Jul  6 23:27:30 2026 daemon.notice pppd[4995]: pppd 2.4.9 started by root, uid 0
Mon Jul  6 23:27:30 2026 daemon.info : 13[KNL] interface ztukuvylmh deactivated
Mon Jul  6 23:27:31 2026 daemon.info : 14[KNL] fe80::b473:43ff:fe57:8e63 disappeared from ztukuvylmh
Mon Jul  6 23:27:31 2026 daemon.info : 16[KNL] interface ztukuvylmh deleted
Mon Jul  6 23:27:31 2026 daemon.err zerotier-one[4871]: Control Plane Stopped
Mon Jul  6 23:27:31 2026 daemon.err zerotier-one[4871]: V6 Control Plane Stopped
Mon Jul  6 23:27:32 2026 daemon.err zerotier-one[5227]: Starting Control Plane...
Mon Jul  6 23:27:32 2026 daemon.err zerotier-one[5227]: Starting V6 Control Plane...
Mon Jul  6 23:27:32 2026 daemon.info : 10[KNL] interface ztukuvylmh activated
Mon Jul  6 23:27:33 2026 daemon.info : 10[KNL] fe80::b473:43ff:fe57:8e63 appeared on ztukuvylmh
Mon Jul  6 23:27:45 2026 daemon.warn pppd[4995]: Timeout waiting for PADS packets
Mon Jul  6 23:27:45 2026 daemon.err pppd[4995]: Unable to complete PPPoE Discovery
Mon Jul  6 23:27:45 2026 daemon.info pppd[4995]: Exit.
Mon Jul  6 23:27:45 2026 daemon.notice netifd: Interface 'wan' is now down
Mon Jul  6 23:27:45 2026 daemon.notice netifd: Interface 'wan' is setting up now
Mon Jul  6 23:27:45 2026 daemon.notice netifd: wan (5317): uci: Entry not found
Mon Jul  6 23:27:45 2026 daemon.notice netifd: wan (5317): sh: out of range
Mon Jul  6 23:27:45 2026 daemon.info pppd[5355]: Plugin pppoe.so loaded.
Mon Jul  6 23:27:45 2026 daemon.info pppd[5355]: PPPoE plugin from pppd 2.4.9
Mon Jul  6 23:27:45 2026 daemon.notice pppd[5355]: pppd 2.4.9 started by root, uid 0
Mon Jul  6 23:27:46 2026 daemon.info : 16[KNL] interface ztukuvylmh deactivated
Mon Jul  6 23:27:46 2026 daemon.info : 12[KNL] fe80::b473:43ff:fe57:8e63 disappeared from ztukuvylmh
Mon Jul  6 23:27:46 2026 daemon.info : 13[KNL] interface ztukuvylmh deleted
Mon Jul  6 23:27:46 2026 daemon.err zerotier-one[5227]: Control Plane Stopped
Mon Jul  6 23:27:46 2026 daemon.err zerotier-one[5227]: V6 Control Plane Stopped
Mon Jul  6 23:27:47 2026 daemon.err zerotier-one[5584]: Starting Control Plane...
Mon Jul  6 23:27:47 2026 daemon.err zerotier-one[5584]: Starting V6 Control Plane...
Mon Jul  6 23:27:47 2026 daemon.info : 15[KNL] interface ztukuvylmh activated
Mon Jul  6 23:27:49 2026 daemon.info : 15[KNL] fe80::b473:43ff:fe57:8e63 appeared on ztukuvylmh
Mon Jul  6 23:28:00 2026 daemon.warn pppd[5355]: Timeout waiting for PADS packets
Mon Jul  6 23:28:00 2026 daemon.err pppd[5355]: Unable to complete PPPoE Discovery
Mon Jul  6 23:28:00 2026 daemon.info pppd[5355]: Exit.
Mon Jul  6 23:28:00 2026 daemon.notice netifd: Interface 'wan' is now down
Mon Jul  6 23:28:00 2026 daemon.notice netifd: Interface 'wan' is setting up now
Mon Jul  6 23:28:00 2026 daemon.notice netifd: wan (5703): uci: Entry not found
Mon Jul  6 23:28:00 2026 daemon.notice netifd: wan (5703): sh: out of range
Mon Jul  6 23:28:00 2026 daemon.info pppd[5741]: Plugin pppoe.so loaded.
Mon Jul  6 23:28:00 2026 daemon.info pppd[5741]: PPPoE plugin from pppd 2.4.9
Mon Jul  6 23:28:00 2026 daemon.notice pppd[5741]: pppd 2.4.9 started by root, uid 0
Mon Jul  6 23:28:01 2026 daemon.info : 09[KNL] interface ztukuvylmh deactivated
Mon Jul  6 23:28:01 2026 daemon.info : 15[KNL] fe80::b473:43ff:fe57:8e63 disappeared from ztukuvylmh
Mon Jul  6 23:28:01 2026 daemon.info : 11[KNL] interface ztukuvylmh deleted
Mon Jul  6 23:28:01 2026 daemon.err zerotier-one[5584]: Control Plane Stopped
Mon Jul  6 23:28:01 2026 daemon.err zerotier-one[5584]: V6 Control Plane Stopped
Mon Jul  6 23:28:03 2026 daemon.err zerotier-one[5970]: Starting Control Plane...
Mon Jul  6 23:28:03 2026 daemon.err zerotier-one[5970]: Starting V6 Control Plane...
Mon Jul  6 23:28:03 2026 daemon.info : 12[KNL] interface ztukuvylmh activated
Mon Jul  6 23:28:04 2026 daemon.info : 12[KNL] fe80::b473:43ff:fe57:8e63 appeared on ztukuvylmh
Mon Jul  6 23:28:15 2026 daemon.warn pppd[5741]: Timeout waiting for PADS packets
Mon Jul  6 23:28:15 2026 daemon.err pppd[5741]: Unable to complete PPPoE Discovery
Mon Jul  6 23:28:15 2026 daemon.info pppd[5741]: Exit.
Mon Jul  6 23:28:15 2026 daemon.notice netifd: Interface 'wan' is now down
Mon Jul  6 23:28:15 2026 daemon.notice netifd: Interface 'wan' is setting up now
Mon Jul  6 23:28:15 2026 daemon.notice netifd: wan (6060): uci: Entry not found
Mon Jul  6 23:28:15 2026 daemon.notice netifd: wan (6060): sh: out of range
Mon Jul  6 23:28:15 2026 daemon.info pppd[6098]: Plugin pppoe.so loaded.
Mon Jul  6 23:28:15 2026 daemon.info pppd[6098]: PPPoE plugin from pppd 2.4.9
Mon Jul  6 23:28:15 2026 daemon.notice pppd[6098]: pppd 2.4.9 started by root, uid 0
Mon Jul  6 23:28:16 2026 daemon.info : 14[KNL] interface ztukuvylmh deactivated
Mon Jul  6 23:28:16 2026 daemon.info : 09[KNL] fe80::b473:43ff:fe57:8e63 disappeared from ztukuvylmh
Mon Jul  6 23:28:16 2026 daemon.info : 11[KNL] interface ztukuvylmh deleted
Mon Jul  6 23:28:16 2026 daemon.err zerotier-one[5970]: Control Plane Stopped
Mon Jul  6 23:28:16 2026 daemon.err zerotier-one[5970]: V6 Control Plane Stopped
Mon Jul  6 23:28:18 2026 daemon.err zerotier-one[6327]: Starting Control Plane...
Mon Jul  6 23:28:18 2026 daemon.err zerotier-one[6327]: Starting V6 Control Plane...
Mon Jul  6 23:28:18 2026 daemon.info : 15[KNL] interface ztukuvylmh activated
Mon Jul  6 23:28:19 2026 daemon.info : 15[KNL] fe80::b473:43ff:fe57:8e63 appeared on ztukuvylmh
Mon Jul  6 23:28:31 2026 daemon.warn pppd[6098]: Timeout waiting for PADS packets
Mon Jul  6 23:28:31 2026 daemon.err pppd[6098]: Unable to complete PPPoE Discovery
Mon Jul  6 23:28:31 2026 daemon.info pppd[6098]: Exit.
Mon Jul  6 23:28:31 2026 daemon.notice netifd: Interface 'wan' is now down
Mon Jul  6 23:28:31 2026 daemon.notice netifd: Interface 'wan' is setting up now
Mon Jul  6 23:28:31 2026 daemon.notice netifd: wan (6416): uci: Entry not found
Mon Jul  6 23:28:31 2026 daemon.notice netifd: wan (6416): sh: out of range
Mon Jul  6 23:28:31 2026 daemon.info pppd[6454]: Plugin pppoe.so loaded.
Mon Jul  6 23:28:31 2026 daemon.info pppd[6454]: PPPoE plugin from pppd 2.4.9
Mon Jul  6 23:28:31 2026 daemon.notice pppd[6454]: pppd 2.4.9 started by root, uid 0
Mon Jul  6 23:28:32 2026 daemon.info : 16[KNL] interface ztukuvylmh deactivated
Mon Jul  6 23:28:32 2026 daemon.info : 11[KNL] fe80::b473:43ff:fe57:8e63 disappeared from ztukuvylmh
Mon Jul  6 23:28:32 2026 daemon.info : 10[KNL] interface ztukuvylmh deleted
Mon Jul  6 23:28:32 2026 daemon.err zerotier-one[6327]: Control Plane Stopped
Mon Jul  6 23:28:32 2026 daemon.err zerotier-one[6327]: V6 Control Plane Stopped
Mon Jul  6 23:28:33 2026 daemon.err zerotier-one[6683]: Starting Control Plane...
Mon Jul  6 23:28:33 2026 daemon.err zerotier-one[6683]: Starting V6 Control Plane...
Mon Jul  6 23:28:33 2026 daemon.info : 15[KNL] interface ztukuvylmh activated
Mon Jul  6 23:28:35 2026 daemon.info : 15[KNL] fe80::b473:43ff:fe57:8e63 appeared on ztukuvylmh
Mon Jul  6 23:28:46 2026 daemon.warn pppd[6454]: Timeout waiting for PADS packets
Mon Jul  6 23:28:46 2026 daemon.err pppd[6454]: Unable to complete PPPoE Discovery
Mon Jul  6 23:28:46 2026 daemon.info pppd[6454]: Exit.
Mon Jul  6 23:28:46 2026 daemon.notice netifd: Interface 'wan' is now down
Mon Jul  6 23:28:46 2026 daemon.notice netifd: Interface 'wan' is setting up now
Mon Jul  6 23:28:46 2026 daemon.notice netifd: wan (6773): uci: Entry not found
Mon Jul  6 23:28:46 2026 daemon.notice netifd: wan (6773): sh: out of range
Mon Jul  6 23:28:46 2026 daemon.info pppd[6810]: Plugin pppoe.so loaded.
Mon Jul  6 23:28:46 2026 daemon.info pppd[6810]: PPPoE plugin from pppd 2.4.9
Mon Jul  6 23:28:46 2026 daemon.notice pppd[6810]: pppd 2.4.9 started by root, uid 0
Mon Jul  6 23:28:47 2026 daemon.info : 12[KNL] interface ztukuvylmh deactivated
Mon Jul  6 23:28:47 2026 daemon.info : 13[KNL] fe80::b473:43ff:fe57:8e63 disappeared from ztukuvylmh
Mon Jul  6 23:28:47 2026 daemon.info : 14[KNL] interface ztukuvylmh deleted
Mon Jul  6 23:28:47 2026 daemon.err zerotier-one[6683]: Control Plane Stopped
Mon Jul  6 23:28:47 2026 daemon.err zerotier-one[6683]: V6 Control Plane Stopped
Mon Jul  6 23:28:48 2026 daemon.err zerotier-one[7041]: Starting Control Plane...
Mon Jul  6 23:28:48 2026 daemon.err zerotier-one[7041]: Starting V6 Control Plane...
Mon Jul  6 23:28:48 2026 daemon.info : 13[KNL] interface ztukuvylmh activated
Mon Jul  6 23:28:50 2026 daemon.info : 11[KNL] fe80::b473:43ff:fe57:8e63 appeared on ztukuvylmh
Mon Jul  6 23:29:01 2026 daemon.warn pppd[6810]: Timeout waiting for PADS packets
Mon Jul  6 23:29:01 2026 daemon.err pppd[6810]: Unable to complete PPPoE Discovery
Mon Jul  6 23:29:01 2026 daemon.info pppd[6810]: Exit.
Mon Jul  6 23:29:01 2026 daemon.notice netifd: Interface 'wan' is now down
Mon Jul  6 23:29:01 2026 daemon.notice netifd: Interface 'wan' is setting up now
Mon Jul  6 23:29:01 2026 daemon.notice netifd: wan (7131): uci: Entry not found
Mon Jul  6 23:29:01 2026 daemon.notice netifd: wan (7131): sh: out of range
Mon Jul  6 23:29:01 2026 daemon.info pppd[7169]: Plugin pppoe.so loaded.
Mon Jul  6 23:29:01 2026 daemon.info pppd[7169]: PPPoE plugin from pppd 2.4.9
Mon Jul  6 23:29:01 2026 daemon.notice pppd[7169]: pppd 2.4.9 started by root, uid 0
Mon Jul  6 23:29:02 2026 daemon.info : 12[KNL] interface ztukuvylmh deactivated
Mon Jul  6 23:29:02 2026 daemon.info : 13[KNL] fe80::b473:43ff:fe57:8e63 disappeared from ztukuvylmh
Mon Jul  6 23:29:02 2026 daemon.info : 15[KNL] interface ztukuvylmh deleted
Mon Jul  6 23:29:02 2026 daemon.err zerotier-one[7041]: Control Plane Stopped
Mon Jul  6 23:29:02 2026 daemon.err zerotier-one[7041]: V6 Control Plane Stopped
Mon Jul  6 23:29:04 2026 daemon.err zerotier-one[7398]: Starting Control Plane...
Mon Jul  6 23:29:04 2026 daemon.err zerotier-one[7398]: Starting V6 Control Plane...
Mon Jul  6 23:29:04 2026 daemon.info : 10[KNL] interface ztukuvylmh activated
Mon Jul  6 23:29:05 2026 daemon.info : 10[KNL] fe80::b473:43ff:fe57:8e63 appeared on ztukuvylmh
Mon Jul  6 23:29:06 2026 daemon.info pppd[7169]: PPP session is 7408
Mon Jul  6 23:29:06 2026 daemon.warn pppd[7169]: Connected to cc:1a:fa:ed:e2:00 via interface eth1
Mon Jul  6 23:29:06 2026 daemon.info pppd[7169]: Renamed interface ppp0 to pppoe-wan
Mon Jul  6 23:29:06 2026 daemon.info pppd[7169]: Using interface pppoe-wan
Mon Jul  6 23:29:06 2026 daemon.notice pppd[7169]: Connect: pppoe-wan <--> eth1
Mon Jul  6 23:29:06 2026 kern.info kernel: [740107.580820] pppoe-wan: renamed from ppp0
Mon Jul  6 23:29:06 2026 daemon.info pppd[7169]: syncppp not active
Mon Jul  6 23:29:07 2026 daemon.info pppd[7169]: CHAP authentication succeeded: Authentication Successful,Welcome!
Mon Jul  6 23:29:07 2026 daemon.notice pppd[7169]: CHAP authentication succeeded
Mon Jul  6 23:29:07 2026 daemon.notice pppd[7169]: peer from calling number CC:1A:FA:ED:E2:00 authorized
Mon Jul  6 23:29:07 2026 daemon.notice pppd[7169]: local  IP address 119.6.178.93
Mon Jul  6 23:29:07 2026 daemon.notice pppd[7169]: remote IP address 119.6.178.1
Mon Jul  6 23:29:07 2026 daemon.notice pppd[7169]: primary   DNS address 119.6.6.6
Mon Jul  6 23:29:07 2026 daemon.notice pppd[7169]: secondary DNS address 221.10.251.197
Mon Jul  6 23:29:07 2026 daemon.info : 13[KNL] 119.6.178.93 appeared on pppoe-wan
Mon Jul  6 23:29:07 2026 daemon.notice pppd[7169]: local  LL address fe80::624e:f634:5f9c:71c9
Mon Jul  6 23:29:07 2026 daemon.notice pppd[7169]: remote LL address fe80::ce1a:faff:feed:e200
Mon Jul  6 23:29:07 2026 daemon.info : 16[KNL] 119.6.178.93 disappeared from pppoe-wan
Mon Jul  6 23:29:07 2026 daemon.info : 12[KNL] 119.6.178.93 appeared on pppoe-wan
Mon Jul  6 23:29:07 2026 daemon.info : 12[KNL] interface pppoe-wan activated
Mon Jul  6 23:29:07 2026 daemon.info : 16[KNL] fe80::624e:f634:5f9c:71c9 appeared on pppoe-wan
Mon Jul  6 23:29:07 2026 daemon.info : 10[KNL] flags changed for fe80::624e:f634:5f9c:71c9 on pppoe-wan
Mon Jul  6 23:29:07 2026 daemon.notice netifd: Network device 'pppoe-wan' link is up
Mon Jul  6 23:29:07 2026 daemon.notice netifd: Interface 'wan' is now up
Mon Jul  6 23:29:07 2026 daemon.notice netifd: Network alias 'pppoe-wan' link is up
Mon Jul  6 23:29:07 2026 daemon.notice netifd: Interface 'wan_6' is enabled
Mon Jul  6 23:29:07 2026 daemon.notice netifd: Interface 'wan_6' has link connectivity
Mon Jul  6 23:29:07 2026 daemon.notice netifd: Interface 'wan_6' is setting up now
Mon Jul  6 23:29:07 2026 user.notice firewall: Reloading firewall due to ifup of wan (pppoe-wan)
Mon Jul  6 23:29:07 2026 user.notice nlbwmon: Reloading nlbwmon due to ifup of wan (pppoe-wan)
Mon Jul  6 23:29:07 2026 daemon.notice miniupnpd[2610]: shutting down MiniUPnPd
Mon Jul  6 23:29:07 2026 daemon.notice miniupnpd[7824]: HTTP listening on port 5000
Mon Jul  6 23:29:07 2026 daemon.notice miniupnpd[7824]: Listening for NAT-PMP/PCP traffic on port 5351
Mon Jul  6 23:29:07 2026 user.notice firewall: Reloading firewall due to ifupdate of wan (pppoe-wan)
Mon Jul  6 23:29:08 2026 user.notice ddns-scripts[7912]: myddns_ipv4: PID '7912' started at 2026-07-06 23:29
Mon Jul  6 23:29:08 2026 daemon.info : 10[KNL] interface ztukuvylmh deactivated
Mon Jul  6 23:29:08 2026 daemon.info : 15[KNL] fe80::b473:43ff:fe57:8e63 disappeared from ztukuvylmh
Mon Jul  6 23:29:08 2026 daemon.info : 16[KNL] interface ztukuvylmh deleted
Mon Jul  6 23:29:08 2026 daemon.err zerotier-one[7398]: Control Plane Stopped
Mon Jul  6 23:29:08 2026 daemon.err zerotier-one[7398]: V6 Control Plane Stopped
Mon Jul  6 23:29:08 2026 daemon.err zerotier-one[8480]: Starting Control Plane...
Mon Jul  6 23:29:08 2026 daemon.err zerotier-one[8480]: Starting V6 Control Plane...
Mon Jul  6 23:29:08 2026 daemon.info : 12[KNL] interface ztukuvylmh activated
Mon Jul  6 23:29:09 2026 daemon.info : 12[KNL] fe80::b473:43ff:fe57:8e63 appeared on ztukuvylmh
Mon Jul  6 23:29:11 2026 daemon.info : 13[KNL] 2408:8266:402:1396:624e:f634:5f9c:71c9 appeared on pppoe-wan
Mon Jul  6 23:29:11 2026 daemon.info : 11[KNL] flags changed for 2408:8266:402:1396:624e:f634:5f9c:71c9 on pppoe-wan
Mon Jul  6 23:29:11 2026 daemon.info : 16[KNL] 2408:8266:403:4c10::1 appeared on br-lan
Mon Jul  6 23:29:11 2026 daemon.notice netifd: Interface 'wan_6' is now up
Mon Jul  6 23:29:11 2026 user.notice firewall: Reloading firewall due to ifup of wan_6 (pppoe-wan)
Mon Jul  6 23:29:11 2026 user.notice nlbwmon: Reloading nlbwmon due to ifup of wan_6 (pppoe-wan)
Mon Jul  6 23:29:12 2026 user.notice ddns-scripts[8897]: myddns_ipv6: PID '8897' started at 2026-07-06 23:29
Mon Jul  6 23:29:12 2026 user.warn ddns-scripts[8897]: myddns_ipv6: Service section disabled! - TERMINATE
Mon Jul  6 23:29:12 2026 user.warn ddns-scripts[8897]: myddns_ipv6: PID '8897' exit WITH ERROR '1' at 2026-07-06 23:29
Mon Jul  6 23:29:13 2026 daemon.info : 14[KNL] flags changed for 2408:8266:403:4c10::1 on br-lan
Mon Jul  6 23:29:25 2026 user.notice ssr-rules[9814]: iptables rules applied successfully
Mon Jul  6 23:31:02 2026 daemon.info : 14[KNL] 192.168.195.25 appeared on ztukuvylmh
Mon Jul  6 23:33:09 2026 daemon.info : 16[NET] received packet: from 111.55.145.68[49392] to 119.6.178.93[500] (848 bytes)
Mon Jul  6 23:33:09 2026 daemon.info : 16[ENC] parsed ID_PROT request 0 [ SA V V V V V V V V V V V V V V ]
Mon Jul  6 23:33:09 2026 daemon.info : 16[IKE] received NAT-T (RFC 3947) vendor ID
Mon Jul  6 23:33:09 2026 daemon.info : 16[IKE] received draft-ietf-ipsec-nat-t-ike vendor ID
Mon Jul  6 23:33:09 2026 daemon.info : 16[IKE] received draft-ietf-ipsec-nat-t-ike-08 vendor ID
Mon Jul  6 23:33:09 2026 daemon.info : 16[IKE] received draft-ietf-ipsec-nat-t-ike-07 vendor ID
Mon Jul  6 23:33:09 2026 daemon.info : 16[IKE] received draft-ietf-ipsec-nat-t-ike-06 vendor ID
Mon Jul  6 23:33:09 2026 daemon.info : 16[IKE] received draft-ietf-ipsec-nat-t-ike-05 vendor ID
Mon Jul  6 23:33:09 2026 daemon.info : 16[IKE] received draft-ietf-ipsec-nat-t-ike-04 vendor ID
Mon Jul  6 23:33:09 2026 daemon.info : 16[IKE] received draft-ietf-ipsec-nat-t-ike-03 vendor ID
Mon Jul  6 23:33:09 2026 daemon.info : 16[IKE] received draft-ietf-ipsec-nat-t-ike-02 vendor ID
Mon Jul  6 23:33:09 2026 daemon.info : 16[IKE] received draft-ietf-ipsec-nat-t-ike-02\n vendor ID
Mon Jul  6 23:33:09 2026 daemon.info : 16[IKE] received XAuth vendor ID
Mon Jul  6 23:33:09 2026 daemon.info : 16[IKE] received Cisco Unity vendor ID
Mon Jul  6 23:33:09 2026 daemon.info : 16[IKE] received FRAGMENTATION vendor ID
Mon Jul  6 23:33:09 2026 daemon.info : 16[IKE] received DPD vendor ID
Mon Jul  6 23:33:09 2026 daemon.info : 16[IKE] 111.55.145.68 is initiating a Main Mode IKE_SA
Mon Jul  6 23:33:09 2026 authpriv.info : 16[IKE] 111.55.145.68 is initiating a Main Mode IKE_SA
Mon Jul  6 23:33:09 2026 daemon.info : 16[CFG] selected proposal: IKE:AES_CBC_128/HMAC_SHA1_96/PRF_HMAC_SHA1/MODP_1024
Mon Jul  6 23:33:09 2026 daemon.info : 16[ENC] generating ID_PROT response 0 [ SA V V V V ]
Mon Jul  6 23:33:09 2026 daemon.info : 16[NET] sending packet: from 119.6.178.93[500] to 111.55.145.68[49392] (160 bytes)
Mon Jul  6 23:33:09 2026 daemon.info : 10[NET] received packet: from 111.55.145.68[49392] to 119.6.178.93[500] (228 bytes)
Mon Jul  6 23:33:09 2026 daemon.info : 10[ENC] parsed ID_PROT request 0 [ KE No NAT-D NAT-D ]
Mon Jul  6 23:33:09 2026 daemon.info : 10[IKE] remote host is behind NAT
Mon Jul  6 23:33:09 2026 daemon.info : 10[ENC] generating ID_PROT response 0 [ KE No NAT-D NAT-D ]
Mon Jul  6 23:33:09 2026 daemon.info : 10[NET] sending packet: from 119.6.178.93[500] to 111.55.145.68[49392] (244 bytes)
Mon Jul  6 23:33:09 2026 daemon.info : 13[NET] received packet: from 111.55.145.68[54231] to 119.6.178.93[4500] (108 bytes)
Mon Jul  6 23:33:09 2026 daemon.info : 13[ENC] parsed ID_PROT request 0 [ ID HASH N(INITIAL_CONTACT) ]
Mon Jul  6 23:33:09 2026 daemon.info : 13[CFG] looking for XAuthInitPSK peer configs matching 119.6.178.93...111.55.145.68[10.149.148.4]
Mon Jul  6 23:33:09 2026 daemon.info : 13[CFG] selected peer config "xauth_psk"
Mon Jul  6 23:33:09 2026 daemon.info : 13[ENC] generating ID_PROT response 0 [ ID HASH ]
Mon Jul  6 23:33:09 2026 daemon.info : 13[NET] sending packet: from 119.6.178.93[4500] to 111.55.145.68[54231] (76 bytes)
Mon Jul  6 23:33:09 2026 daemon.info : 13[ENC] generating TRANSACTION request 1304555116 [ HASH CPRQ(X_USER X_PWD) ]
Mon Jul  6 23:33:09 2026 daemon.info : 13[NET] sending packet: from 119.6.178.93[4500] to 111.55.145.68[54231] (76 bytes)
Mon Jul  6 23:33:09 2026 daemon.info : 11[NET] received packet: from 111.55.145.68[54231] to 119.6.178.93[4500] (92 bytes)
Mon Jul  6 23:33:09 2026 daemon.info : 11[ENC] parsed TRANSACTION response 1304555116 [ HASH CPRP(X_USER X_PWD) ]
Mon Jul  6 23:33:09 2026 daemon.info : 11[IKE] XAuth authentication of 'ipsec-user' successful
Mon Jul  6 23:33:09 2026 daemon.info : 11[ENC] generating TRANSACTION request 2138908001 [ HASH CPS(X_STATUS) ]
Mon Jul  6 23:33:09 2026 daemon.info : 11[NET] sending packet: from 119.6.178.93[4500] to 111.55.145.68[54231] (76 bytes)
Mon Jul  6 23:33:09 2026 daemon.info : 12[NET] received packet: from 111.55.145.68[54231] to 119.6.178.93[4500] (76 bytes)
Mon Jul  6 23:33:09 2026 daemon.info : 12[ENC] parsed TRANSACTION response 2138908001 [ HASH CPA(X_STATUS) ]
Mon Jul  6 23:33:09 2026 daemon.info : 12[IKE] IKE_SA xauth_psk[2] established between 119.6.178.93[119.6.178.93]...111.55.145.68[10.149.148.4]
Mon Jul  6 23:33:09 2026 authpriv.info : 12[IKE] IKE_SA xauth_psk[2] established between 119.6.178.93[119.6.178.93]...111.55.145.68[10.149.148.4]
Mon Jul  6 23:33:09 2026 daemon.info : 12[IKE] scheduling reauthentication in 9796s
Mon Jul  6 23:33:09 2026 daemon.info : 12[IKE] maximum IKE_SA lifetime 10336s
Mon Jul  6 23:33:09 2026 daemon.info : 15[NET] received packet: from 111.55.145.68[54231] to 119.6.178.93[4500] (172 bytes)
Mon Jul  6 23:33:09 2026 daemon.info : 15[ENC] unknown attribute type (28683)
Mon Jul  6 23:33:09 2026 daemon.info : 15[ENC] parsed TRANSACTION request 3017108308 [ HASH CPRQ(ADDR MASK DNS NBNS EXP VER U_BANNER U_DEFDOM U_SPLITDNS U_SPLITINC U_LOCALLAN U_PFS U_SAVEPWD U_FWTYPE U_BKPSRV (28683)) ]
Mon Jul  6 23:33:09 2026 daemon.info : 15[IKE] peer requested virtual IP %any
Mon Jul  6 23:33:09 2026 daemon.info : 15[CFG] reassigning offline lease to 'ipsec-user'
Mon Jul  6 23:33:09 2026 daemon.info : 15[IKE] assigning virtual IP 10.0.0.50 to peer 'ipsec-user'
Mon Jul  6 23:33:09 2026 daemon.info : 15[ENC] generating TRANSACTION response 3017108308 [ HASH CPRP(ADDR DNS) ]
Mon Jul  6 23:33:09 2026 daemon.info : 15[NET] sending packet: from 119.6.178.93[4500] to 111.55.145.68[54231] (92 bytes)
Mon Jul  6 23:33:09 2026 daemon.info : 14[NET] received packet: from 111.55.145.68[54231] to 119.6.178.93[4500] (380 bytes)
Mon Jul  6 23:33:09 2026 daemon.info : 14[ENC] parsed QUICK_MODE request 4042239046 [ HASH SA No ID ID ]
Mon Jul  6 23:33:09 2026 daemon.info : 14[CFG] selected proposal: ESP:AES_CBC_128/HMAC_SHA1_96/NO_EXT_SEQ
Mon Jul  6 23:33:09 2026 daemon.info : 14[ENC] generating QUICK_MODE response 4042239046 [ HASH SA No ID ID ]
Mon Jul  6 23:33:09 2026 daemon.info : 14[NET] sending packet: from 119.6.178.93[4500] to 111.55.145.68[54231] (172 bytes)
Mon Jul  6 23:33:09 2026 daemon.info : 16[NET] received packet: from 111.55.145.68[54231] to 119.6.178.93[4500] (60 bytes)
Mon Jul  6 23:33:09 2026 daemon.info : 16[ENC] parsed QUICK_MODE request 4042239046 [ HASH ]
Mon Jul  6 23:33:09 2026 daemon.info : 16[IKE] CHILD_SA xauth_psk{2} established with SPIs 74f679a7_i 00957fbe_o and TS 0.0.0.0/0 === 10.0.0.50/32
Mon Jul  6 23:33:09 2026 authpriv.info : 16[IKE] CHILD_SA xauth_psk{2} established with SPIs 74f679a7_i 00957fbe_o and TS 0.0.0.0/0 === 10.0.0.50/32
Mon Jul  6 23:33:31 2026 daemon.info : 12[NET] received packet: from 111.55.145.68[54231] to 119.6.178.93[4500] (92 bytes)
Mon Jul  6 23:33:31 2026 daemon.info : 12[ENC] parsed INFORMATIONAL_V1 request 1601316718 [ HASH N(DPD) ]
Mon Jul  6 23:33:31 2026 daemon.info : 12[ENC] generating INFORMATIONAL_V1 request 3666242646 [ HASH N(DPD_ACK) ]
Mon Jul  6 23:33:31 2026 daemon.info : 12[NET] sending packet: from 119.6.178.93[4500] to 111.55.145.68[54231] (92 bytes)


```

**Comment by coolsnowwolf** [comment]
已按日志中的已验证 workaround 固化修复：当逻辑接口 `wan` 发生 `ifup`，且 IPsec VPN Server 已启用时，自动重启对应服务，重建 PPPoE 重拨后 kernel-libipsec 的路由和运行时状态。脚本不会在 ifdown、其他接口或服务未启用时触发。\n\n已同步两个 LuCI 分支：\n- `openwrt-23.05`：29fa8153e358d31e8fcf9f8504c1cf757666006c（调用该分支的 `/etc/init.d/ipsec`）\n- `openwrt-25.12`：8ff7e3184e26ad85383acec04dcc3a1beb3ca81d（调用重命名后的 `/etc/init.d/ipsec-vpnd`）\n\n验证：两个脚本均通过 `sh -n`；25.12 在 x86_64 下执行 `make package/feeds/luci/luci-app-ipsec-vpnd/clean package/feeds/luci/luci-app-ipsec-vpnd/compile -j30` 通过，生成 IPK，包内脚本路径正确且权限为 0755。当前环境没有可重拨的真实 PPPoE/IPsec 对端，因此未宣称完成在线重拨实机复测。
