### DISCUSSION TITLE
openwrt所在的53端口一直受到解析域名为host_ip_address的请求，请问一下是什么程序引起的？

### DISCUSSION THREAD

**Discussion by huoshan12345** [coolsnowwolf/lede#12476] [Q&A / 快速问答]
我用`tcpdump`监听53端口并根据域名过滤，命令如下：
`tcpdump -i lo -n udp port 53 | grep host_ip_address`

结果如下：
```
20:27:41.288548 IP 127.0.0.1.50359 > 127.0.0.1.53: 25764+ A? host_ip_address.lan. (37)
20:27:41.288570 IP6 ::1.50359 > ::1.53: 25764+ A? host_ip_address.lan. (37)
20:27:41.288577 IP 127.0.0.1.50359 > 127.0.0.1.53: 25935+ AAAA? host_ip_address.lan. (37)
20:27:41.288580 IP6 ::1.50359 > ::1.53: 25935+ AAAA? host_ip_address.lan. (37)
20:27:41.288995 IP 127.0.0.1.57505 > 127.0.0.1.53: 40323+ A? host_ip_address. (33)
20:27:41.289005 IP6 ::1.57505 > ::1.53: 40323+ A? host_ip_address. (33)
20:27:41.289009 IP 127.0.0.1.57505 > 127.0.0.1.53: 40524+ AAAA? host_ip_address. (33)
20:27:41.289012 IP6 ::1.57505 > ::1.53: 40524+ AAAA? host_ip_address. (33)
20:27:46.290154 IP 127.0.0.1.48839 > 127.0.0.1.53: 18808+ A? host_ip_address.lan. (37)
20:27:46.290170 IP6 ::1.48839 > ::1.53: 18808+ A? host_ip_address.lan. (37)
20:27:46.290176 IP 127.0.0.1.48839 > 127.0.0.1.53: 19194+ AAAA? host_ip_address.lan. (37)
20:27:46.290179 IP6 ::1.48839 > ::1.53: 19194+ AAAA? host_ip_address.lan. (37)
20:27:46.294005 IP 127.0.0.1.59787 > 127.0.0.1.53: 6261+ A? host_ip_address. (33)
```
大概**每5秒**就会有四个请求解析域名`host_ip_address`和`host_ip_address.lan`

我本想根据上面的端口号查询对应的程序名，命令如下：
`netstat -anp | grep 59787`
但试了几个端口号都搜不到程序，我猜是因为这个端口发送完请求很快就销毁了所以查不到记录

试了很多方法实在不会了，所以来这里问问。
这有可能是什么程序或者插件发送的请求？

**Comment by huoshan12345** [comment]
是smaba这个程序一直在请求。
我用了土办法最后找到了，我遍历了openwrt系统盘上的所有文本文件，然后在/etc/samba/smb.conf.template里面找到了
